{
  "artifacts": [],
  "created_at": "2026-07-29T12:00:00+00:00",
  "extensions": {
    "primary_claim_record_id": "ni:///sha-256;Jjoy1p3I8qSMqdLADk0J-22POPmczuNN_aQo4YCMTRY"
  },
  "package_root": "ni:///sha-256;Q3GoAq97GN-Q7B-vgySsFkDb_KzqVn4xJkvaLs6E-lg",
  "records": [
    {
      "media_type": "application/json",
      "path": "records/001-claim-version.json",
      "record_id": "ni:///sha-256;c8vx_FwTuRdgffinQn-EndbsZP3gtZGwIBtTiVAdeK0",
      "record_type": "claim-version",
      "sha256": "sha256:efd723fdb8a29b770b356bbe91ff570f59dbd9dad3cd4c9f4249d475c404ec33"
    },
    {
      "media_type": "application/json",
      "path": "records/002-evidence.json",
      "record_id": "ni:///sha-256;DyNZBfWLsJN7dYwF3E9ZuaQrpd3G6LxbeuB3Kwid3aw",
      "record_type": "evidence",
      "sha256": "sha256:e7120631fe8fb8aa6fc1fc93c14e00affb028fcaa5e986ddae557e4f8c43cb56"
    },
    {
      "media_type": "application/json",
      "path": "records/003-assessment.json",
      "record_id": "ni:///sha-256;9J7-ZypukTKSPCuQygsMNW6SM8B285mdSRp1eTJaq2o",
      "record_type": "assessment",
      "sha256": "sha256:f61223c0902765fa9eda89dd431bc042bd2abbabc56cbff912ae43dcb135d0fe"
    },
    {
      "media_type": "application/json",
      "path": "records/004-assessment.json",
      "record_id": "ni:///sha-256;O-f3Ah6H1v2YcL3xJrnaR46ojP5uixJtf8E_kH-HBXw",
      "record_type": "assessment",
      "sha256": "sha256:81df49423a6df227562ad4ae4d5d642a1656d70b7b39dc120a813e82a6bdc1af"
    },
    {
      "media_type": "application/json",
      "path": "records/005-assessment.json",
      "record_id": "ni:///sha-256;evbJHQfFu4Hu-O2gEuXHlJQwvkg9VC6Au2DYPk6_t-o",
      "record_type": "assessment",
      "sha256": "sha256:537af73d5ceece8572ee210fd09843d72b363bf08c4c9ec28515eb325f0f40bb"
    },
    {
      "media_type": "application/json",
      "path": "records/006-assessment.json",
      "record_id": "ni:///sha-256;eGCtF9YQ2a4KK9Jki4seObGQvlaTZotgCrTLXgJiGqI",
      "record_type": "assessment",
      "sha256": "sha256:9b80d8e86a8e0736f3e5708b68ce961850a59fd4f6c3dfbd6295950309e01c9b"
    },
    {
      "media_type": "application/json",
      "path": "records/007-assessment.json",
      "record_id": "ni:///sha-256;nUcYJPfS5aUT-Is6mQ_RJrda5_kQh-6n4egabS40Zu0",
      "record_type": "assessment",
      "sha256": "sha256:78752685b53e798c1f0daee5b5ac1c5523a7bb0f3b013df4a065266cf791ef7a"
    },
    {
      "media_type": "application/json",
      "path": "records/008-assessment.json",
      "record_id": "ni:///sha-256;jdHjR8L6VLpfJ2-GCkNhLzmBU2ReUTVOD75mjq46RBQ",
      "record_type": "assessment",
      "sha256": "sha256:76b21d108029dc1a13fd98ae71dc26b3a46fe45a000d90b761f82a6dc0c409e3"
    },
    {
      "media_type": "application/json",
      "path": "records/009-assessment.json",
      "record_id": "ni:///sha-256;uLcW2yu9Xhz8y9GEHF5kC_MO2jkFMWaUGreLEOj4DRI",
      "record_type": "assessment",
      "sha256": "sha256:bc0e4f8baf1d7ab2416b5112445c7a0322c2b9d160fc4111d19d667ec0622351"
    },
    {
      "media_type": "application/json",
      "path": "records/010-assessment.json",
      "record_id": "ni:///sha-256;vnKGGoGUUGL0MfynFWbRQV55uwG0QxWpLjAgmOJGxnk",
      "record_type": "assessment",
      "sha256": "sha256:a1875f934239bb6e132f9bc3ff6032a897c7e52e652539249d58b22c0f6120b8"
    },
    {
      "media_type": "application/json",
      "path": "records/011-assessment.json",
      "record_id": "ni:///sha-256;YGY08_x-gemTfXgV5k_1xoHHl0TTO0fOcZ0yDLuAbV0",
      "record_type": "assessment",
      "sha256": "sha256:0d9d3dd9bfa61fb28cbcc338abb5132fa8fb3c6859ebcaf4e257774c1708ea89"
    },
    {
      "media_type": "application/json",
      "path": "records/012-assessment.json",
      "record_id": "ni:///sha-256;DLJ8FST6im6nybCrK_-TA3gDrSqr0jKaXcG8EBu1OdY",
      "record_type": "assessment",
      "sha256": "sha256:c67f629baedca67898305da41d29e1430c4437e7c5e41711cbbbc84d5a9c36c9"
    },
    {
      "media_type": "application/json",
      "path": "records/013-assessment.json",
      "record_id": "ni:///sha-256;2-RXPSEzDPaV8E9sFs965dqhnlRMyJnOhHydjWAMRuw",
      "record_type": "assessment",
      "sha256": "sha256:0e50bd5a8c81e4a17093766b8e987feb8dbbc6b65141c47c70b3e6f4deb1ac16"
    },
    {
      "media_type": "application/json",
      "path": "records/014-assessment.json",
      "record_id": "ni:///sha-256;tXNmbNzG6c747Sr3YD9uxpFJNxINYU1iTXRiq9lF-6g",
      "record_type": "assessment",
      "sha256": "sha256:c1d5ef46b591fb33252bfb68fded00976629bb55f4798288e5274d81aa2ddd34"
    },
    {
      "media_type": "application/json",
      "path": "records/015-claim-version.json",
      "record_id": "ni:///sha-256;Jjoy1p3I8qSMqdLADk0J-22POPmczuNN_aQo4YCMTRY",
      "record_type": "claim-version",
      "sha256": "sha256:94638858d0125998d8ca482914e0efda41b518ba53e3fa8318c8c58e6f8f292d"
    },
    {
      "media_type": "application/json",
      "path": "records/016-relation.json",
      "record_id": "ni:///sha-256;YFkwmdYZ2hj4rGKXnCGkpDqKqcHqHAPwjXHDEyITmgM",
      "record_type": "relation",
      "sha256": "sha256:9323e89adf068f148569a4a771d93445eb608e59585a2f221ff2e9b1ef51def5"
    },
    {
      "media_type": "application/json",
      "path": "records/017-assessment.json",
      "record_id": "ni:///sha-256;8rQHgMrx--c7Rc5ZXcxIbq96kHu4kx9Wm__buwOpWmc",
      "record_type": "assessment",
      "sha256": "sha256:0cde09b95a50de53814c922ed5dd793edc778d1f853dfda2372b4ee7112afe50"
    },
    {
      "media_type": "application/json",
      "path": "records/018-evidence.json",
      "record_id": "ni:///sha-256;uklWwtnxcUwUzK3k90yfXP7Qo0ahlMPtfATHJF0gfqM",
      "record_type": "evidence",
      "sha256": "sha256:626705cd8704a57e72ba9f0ed820d22e4c9bfa3efec72e2bfdcda8cba08feef6"
    },
    {
      "media_type": "application/json",
      "path": "records/019-assessment.json",
      "record_id": "ni:///sha-256;OtZo7-XjZb3Y5aGT7-xF6VOH147ar7m2964dhHurlPM",
      "record_type": "assessment",
      "sha256": "sha256:e1c8ec1031cd5f7e82e5660d65065786f259796229a58c50f4bb43818f71629c"
    },
    {
      "media_type": "application/json",
      "path": "records/020-assessment.json",
      "record_id": "ni:///sha-256;6EAKjAOrn9E6yiiCHpnvQeKJi-PmsPzFB-ONRrXulcU",
      "record_type": "assessment",
      "sha256": "sha256:a1222a9ccbfd65254487aab4baeaa2efe4d423a0ef523b0f35cf0f3862a8a327"
    },
    {
      "media_type": "application/json",
      "path": "records/021-assessment.json",
      "record_id": "ni:///sha-256;boGtvYBnNcodQslaubvh48ZsJ_i7yYIDD1D98SqPnic",
      "record_type": "assessment",
      "sha256": "sha256:bfdfa6c1e08b3bb1acb5b2312f0dc089aa9f6217067c29704a3ca2360f072592"
    },
    {
      "media_type": "application/json",
      "path": "records/022-assessment.json",
      "record_id": "ni:///sha-256;_xPQMQbEQytkyAw-YZLcoQCR2GSyRsvWz7pZFCuC6QA",
      "record_type": "assessment",
      "sha256": "sha256:9d56e709008f3884b792688d85c15330ac964188634696c186a14a15e31dcab6"
    },
    {
      "media_type": "application/json",
      "path": "records/023-assessment.json",
      "record_id": "ni:///sha-256;B7VLynXgUi8DuUHkYxbwbLmrq9XQ1T69kcjXPIWlBkE",
      "record_type": "assessment",
      "sha256": "sha256:73df1b9f5438b7964024d19df69f95369ff1cdb77bdc533769165afefb7f656e"
    },
    {
      "media_type": "application/json",
      "path": "records/024-assessment.json",
      "record_id": "ni:///sha-256;VE0bDUCi9VAqG6ax0_Kb7L9VuAt0QnYDvtuFXqK8n74",
      "record_type": "assessment",
      "sha256": "sha256:c9ad5a57b1e241e96fa03f9aea024f1d606b6e27a181a0b6e842a018ff0bf0d5"
    },
    {
      "media_type": "application/json",
      "path": "records/025-assessment.json",
      "record_id": "ni:///sha-256;l7UfybRz41pUelmj5yKjO8rS88Btns3J-LjMCCEo07M",
      "record_type": "assessment",
      "sha256": "sha256:1d6a7f2b57bab8c14600a833a6aaed6b331a24b32c7133e3a2cf54bc580691f2"
    },
    {
      "media_type": "application/json",
      "path": "records/026-assessment.json",
      "record_id": "ni:///sha-256;BtjGIXse-6PcsOZqEdZ1dN0phj095cwTpqgypAetqKw",
      "record_type": "assessment",
      "sha256": "sha256:38e1b27ce97fcd6684edc97ec0eac5401d851896c1c9015092f6be4094278973"
    },
    {
      "media_type": "application/json",
      "path": "records/027-assessment.json",
      "record_id": "ni:///sha-256;XM3bzFHSkFF1UrbDD5FsmtZm_IxUVVL8gzcORomjGxI",
      "record_type": "assessment",
      "sha256": "sha256:3f848b4623b07321f7aa736b2f7082a70135d1c07106f658ad6eefed4537fefb"
    },
    {
      "media_type": "application/json",
      "path": "records/028-assessment.json",
      "record_id": "ni:///sha-256;T1bdYIg1xZz8ig7tmvG-M8-cHSkKxZaHLslodtanLUA",
      "record_type": "assessment",
      "sha256": "sha256:094ade915edc1b1d9d5f2e096be1158efd607d7454f65e1116ba240f89e2f42e"
    },
    {
      "media_type": "application/json",
      "path": "records/029-assessment.json",
      "record_id": "ni:///sha-256;nK6VsBX7iDvXM1BaE6kerMQTzIdAX_-ORVrsBeM9kc0",
      "record_type": "assessment",
      "sha256": "sha256:6f1c3838a9d0876564cf8a5c01edfd7a13ed0f4c7ea3f629dc3959f5b344eeac"
    },
    {
      "media_type": "application/json",
      "path": "records/030-assessment.json",
      "record_id": "ni:///sha-256;y8ZaHielLLmCYyebiH6fkVCbyQ5rRC0B_pXYrbZ2S04",
      "record_type": "assessment",
      "sha256": "sha256:a045b232e71859e269458c0f67399fbc8b69b29f8bfd113b016c153c5c9b95be"
    }
  ],
  "schema_version": "claimpack-manifest/0.1"
}
